{
  "created_at": "2026-08-11T07:40:00Z",
  "dataset_id": "momtsim-v1",
  "dataset_version": "1",
  "file_count": 1,
  "inventory_sha256": "fbd89dd3028b8591c1e49aa42b342cb53dc556c0c2172fb7df677c33bcb5b992",
  "network_acquisition_executed": false,
  "promotable_for_training": false,
  "quarantine_reasons": [],
  "request_sha256": "2404db602eaf55d4397edaeac0702524b00810fb328dd2ab0cb8a591d78a39e5",
  "schema_version": "dataset-registration-manifest-v1",
  "source_bytes_committed": false,
  "source_kind": "file",
  "source_sha256": "da951eb95735da96271740a3e66b676b342d3831ce3111cd19dbfa020d3bd0a7",
  "source_size_bytes": 156564413,
  "status": "registered",
  "validation_spec_sha256": "ed04b3f9eb8cb35678c458a299b3fc33c5a1b968e47caba58aba9617c1d21a25",
  "validation_summary": {
    "dataset_kind": "transaction_csv",
    "duplicate_row_count": 0,
    "forbidden_primary_benchmark_columns": [
      "oldBalInitiator",
      "newBalInitiator",
      "oldBalRecipient",
      "newBalRecipient"
    ],
    "invalid_amount_count": 0,
    "invalid_label_count": 0,
    "null_cell_count": 0,
    "positive_count": 175518,
    "row_count": 1720181,
    "step_count": 144
  }
}
